{"annotation_owner_role":"quality_owner","annotation_status":"approved","pages":[{"labels":[{"bbox_pdf":[595.5,27,663.5,49],"expected_disposition":"candidate","expected_projection":"geometric_tolerance","label_id":"P1-P01","symbol_kinds":["gdt_perpendicularity"]},{"bbox_pdf":[702.5,30,733,57],"expected_disposition":"candidate","expected_projection":"roughness","label_id":"P1-P02","symbol_kinds":["surface_roughness"]},{"bbox_pdf":[926.5,33.5,946,54],"expected_disposition":"non_inspection","expected_projection":null,"label_id":"P1-P03","symbol_kinds":["revision_marker"]},{"bbox_pdf":[926.5,61,946,82],"expected_disposition":"non_inspection","expected_projection":null,"label_id":"P1-P04","symbol_kinds":["revision_marker"]},{"bbox_pdf":[926.5,89,946,110],"expected_disposition":"non_inspection","expected_projection":null,"label_id":"P1-P05","symbol_kinds":["revision_marker"]},{"bbox_pdf":[702,128.5,733,152.5],"expected_disposition":"candidate","expected_projection":"roughness","label_id":"P1-P06","symbol_kinds":["surface_roughness"]},{"bbox_pdf":[705.5,160,774.5,182],"expected_disposition":"candidate","expected_projection":"geometric_tolerance","label_id":"P1-P07","symbol_kinds":["gdt_perpendicularity"]},{"bbox_pdf":[232,184.5,300.5,206.5],"expected_disposition":"candidate","expected_projection":"geometric_tolerance","label_id":"P1-P08","symbol_kinds":["gdt_parallelism"]},{"bbox_pdf":[232,205.5,281,227],"expected_disposition":"candidate","expected_projection":"geometric_tolerance","label_id":"P1-P09","symbol_kinds":["gdt_flatness"]},{"bbox_pdf":[321,195.5,395.5,212],"expected_disposition":"candidate","expected_projection":"thread","label_id":"P1-P10","symbol_kinds":["depth"]},{"bbox_pdf":[628,187,703.5,203],"expected_disposition":"candidate","expected_projection":"thread","label_id":"P1-P11","symbol_kinds":["depth"]},{"bbox_pdf":[675.5,203,706,231],"expected_disposition":"candidate","expected_projection":"roughness","label_id":"P1-P12","symbol_kinds":["surface_roughness"]},{"bbox_pdf":[273.5,237.5,395,266.5],"expected_disposition":"candidate","expected_projection":"composite","label_id":"P1-P13","symbol_kinds":["diameter","depth"]},{"bbox_pdf":[105.5,283.5,146,306],"expected_disposition":"reference_context","expected_projection":null,"label_id":"P1-P14","symbol_kinds":["datum_reference"]},{"bbox_pdf":[691,272,713,341.5],"expected_disposition":"candidate","expected_projection":"geometric_tolerance","label_id":"P1-P15","symbol_kinds":["gdt_perpendicularity"]},{"bbox_pdf":[817.5,353,864.5,371.5],"expected_disposition":"candidate","expected_projection":"diameter_dimension","label_id":"P1-P16","symbol_kinds":["diameter"]},{"bbox_pdf":[117,382,141,417.5],"expected_disposition":"candidate","expected_projection":"roughness","label_id":"P1-P17","symbol_kinds":["surface_roughness"]},{"bbox_pdf":[193.5,402,238,434],"expected_disposition":"candidate","expected_projection":"roughness","label_id":"P1-P18","symbol_kinds":["surface_roughness"]},{"bbox_pdf":[661,382,693.5,415],"expected_disposition":"candidate","expected_projection":"roughness","label_id":"P1-P19","symbol_kinds":["surface_roughness"]},{"bbox_pdf":[876,395.5,954.5,414.5],"expected_disposition":"candidate","expected_projection":"diameter_dimension","label_id":"P1-P20","symbol_kinds":["diameter"]},{"bbox_pdf":[1018,388,1054,421.5],"expected_disposition":"candidate","expected_projection":"roughness","label_id":"P1-P21","symbol_kinds":["surface_roughness"]},{"bbox_pdf":[1051,453,1120,476],"expected_disposition":"candidate","expected_projection":"geometric_tolerance","label_id":"P1-P22","symbol_kinds":["gdt_parallelism"]},{"bbox_pdf":[1051,474.5,1102.5,496],"expected_disposition":"candidate","expected_projection":"geometric_tolerance","label_id":"P1-P23","symbol_kinds":["gdt_flatness"]},{"bbox_pdf":[618,520.5,695,542],"expected_disposition":"candidate","expected_projection":"thread","label_id":"P1-P24","symbol_kinds":["depth"]},{"bbox_pdf":[346,751,389,774],"expected_disposition":"candidate","expected_projection":"diameter_dimension","label_id":"P1-P25","symbol_kinds":["diameter"]},{"bbox_pdf":[545,796.5,635,825],"expected_disposition":"candidate","expected_projection":"diameter_dimension","label_id":"P1-P26","symbol_kinds":["diameter"]},{"bbox_pdf":[820.5,257.5,850.5,288],"expected_disposition":"non_inspection","expected_projection":null,"label_id":"FN-01","negative_family":"part_or_hole_geometry","symbol_kinds":["frozen_negative"]},{"bbox_pdf":[507.5,402,523.5,427.5],"expected_disposition":"non_inspection","expected_projection":null,"label_id":"FN-02","negative_family":"hatch_center_or_cross","symbol_kinds":["frozen_negative"]},{"bbox_pdf":[425,98,609,114],"expected_disposition":"non_inspection","expected_projection":null,"label_id":"FN-03","negative_family":"dimension_leader_or_section_line","symbol_kinds":["frozen_negative"]},{"bbox_pdf":[774,133.5,803.5,151.5],"expected_disposition":"non_inspection","expected_projection":null,"label_id":"FN-04","negative_family":"view_or_section_label","symbol_kinds":["frozen_negative"]},{"bbox_pdf":[950.5,14,1176.5,113.5],"expected_disposition":"non_inspection","expected_projection":null,"label_id":"FN-05","negative_family":"revision_table_or_invalid_marker","symbol_kinds":["frozen_negative"]},{"bbox_pdf":[813,687.5,848,711],"expected_disposition":"non_inspection","expected_projection":null,"label_id":"FN-06","negative_family":"datum_like_letter_or_table_cell","symbol_kinds":["frozen_negative"]},{"bbox_pdf":[1033,680,1175,727.5],"expected_disposition":"non_inspection","expected_projection":null,"label_id":"FN-07","negative_family":"watermark_logo_title_or_signoff","symbol_kinds":["frozen_negative"]},{"bbox_pdf":[183.5,447,365.5,556],"expected_disposition":"non_inspection","expected_projection":null,"label_id":"FN-08","negative_family":"isometric_hole_slot_or_edge","symbol_kinds":["frozen_negative"]},{"bbox_pdf":[783,539.5,1035,668.5],"expected_disposition":"non_inspection","expected_projection":null,"label_id":"FN-09","negative_family":"ordinary_text_number_material_or_requirement","symbol_kinds":["frozen_negative"]},{"bbox_pdf":[189.5,194,203.5,210],"expected_disposition":"ambiguous","expected_projection":null,"label_id":"FN-13","negative_family":"revision_table_or_invalid_marker","symbol_kinds":["frozen_negative"]}],"page_index":0},{"labels":[{"bbox_pdf":[272.5,43.5,367.5,83],"expected_disposition":"candidate","expected_projection":"composite","label_id":"P2-P02","symbol_kinds":["diameter","depth","counterbore"]},{"bbox_pdf":[258.5,155.5,338,175],"expected_disposition":"candidate","expected_projection":"diameter_dimension","label_id":"P2-P03","symbol_kinds":["diameter"]},{"bbox_pdf":[336,155.5,410,175],"expected_disposition":"candidate","expected_projection":"thread","label_id":"P2-P04","symbol_kinds":["depth"]},{"bbox_pdf":[342,234,425.5,253.5],"expected_disposition":"candidate","expected_projection":"diameter_dimension","label_id":"P2-P05","symbol_kinds":["diameter"]},{"bbox_pdf":[337,254.5,430.5,293.5],"expected_disposition":"candidate","expected_projection":"composite","label_id":"P2-P06","symbol_kinds":["diameter","depth","counterbore"]},{"bbox_pdf":[531,248.5,620.5,269.5],"expected_disposition":"candidate","expected_projection":"diameter_dimension","label_id":"P2-P07","symbol_kinds":["diameter"]},{"bbox_pdf":[843,224,875.5,256],"expected_disposition":"non_inspection","expected_projection":null,"label_id":"P2-P08","symbol_kinds":["revision_marker"]},{"bbox_pdf":[870,237.5,951,257.5],"expected_disposition":"candidate","expected_projection":"thread","label_id":"P2-P09","symbol_kinds":["depth"]},{"bbox_pdf":[617.5,283,650,314],"expected_disposition":"non_inspection","expected_projection":null,"label_id":"P2-P10","symbol_kinds":["revision_marker"]},{"bbox_pdf":[603.5,310,675.5,330],"expected_disposition":"candidate","expected_projection":"thread","label_id":"P2-P11","symbol_kinds":["depth"]},{"bbox_pdf":[302.5,306.5,403.5,326.5],"expected_disposition":"candidate","expected_projection":"thread","label_id":"P2-P12","symbol_kinds":["depth"]},{"bbox_pdf":[819,301,899,323],"expected_disposition":"candidate","expected_projection":"thread","label_id":"P2-P13","symbol_kinds":["depth"]},{"bbox_pdf":[272,334,300.5,366.5],"expected_disposition":"candidate","expected_projection":"roughness","label_id":"P2-P14","symbol_kinds":["surface_roughness"]},{"bbox_pdf":[329.5,382.5,362.5,413.5],"expected_disposition":"non_inspection","expected_projection":null,"label_id":"P2-P15","symbol_kinds":["revision_marker"]},{"bbox_pdf":[300,401.5,371,420.5],"expected_disposition":"candidate","expected_projection":"thread","label_id":"P2-P16","symbol_kinds":["depth"]},{"bbox_pdf":[1052.5,318.5,1135,340.5],"expected_disposition":"candidate","expected_projection":"thread","label_id":"P2-P17","symbol_kinds":["depth"]},{"bbox_pdf":[126,421,157.5,457.5],"expected_disposition":"candidate","expected_projection":"roughness","label_id":"P2-P18","symbol_kinds":["surface_roughness"]},{"bbox_pdf":[1041.5,439,1121.5,461.5],"expected_disposition":"candidate","expected_projection":"thread","label_id":"P2-P19","symbol_kinds":["depth"]},{"bbox_pdf":[343.5,455.5,434,491],"expected_disposition":"candidate","expected_projection":"composite","label_id":"P2-P20","symbol_kinds":["diameter","depth","counterbore"]},{"bbox_pdf":[1034.5,462,1064.5,496.5],"expected_disposition":"candidate","expected_projection":"roughness","label_id":"P2-P21","symbol_kinds":["surface_roughness"]},{"bbox_pdf":[353,519,442.5,542],"expected_disposition":"candidate","expected_projection":"diameter_dimension","label_id":"P2-P22","symbol_kinds":["diameter"]},{"bbox_pdf":[548,502,623.5,523.5],"expected_disposition":"candidate","expected_projection":"thread","label_id":"P2-P23","symbol_kinds":["depth"]},{"bbox_pdf":[900,510,1032.5,543],"expected_disposition":"candidate","expected_projection":"composite","label_id":"P2-P24","symbol_kinds":["diameter","depth"]},{"bbox_pdf":[787.5,540,879.5,563.5],"expected_disposi